{
  "schema_version": "template-diff-report-v3",
  "artifact_type": "TemplateDiffReportV3",
  "generated_at": "2026-09-07T03:18:21.730853Z",
  "status": "PASS",
  "compiler": {
    "id": "fixed-template-compiler-v3",
    "version": "3.0.0"
  },
  "source": {
    "sha256": "54E3CACE204DD1958A2C62991B13C59FB5B22151CC2911AEC674F1811B89224C",
    "ir_sha256": "3ABB5D8A2FC3B3B2FDE498C34F859B97AA31E8F42FFD3C18AA1CDCE268197CCF"
  },
  "candidate": {
    "sha256": "AC8F9113082E5EADAA9F6139EC4CCCB375FD50FF345A221712939A6D2A7F0E0B",
    "ir_sha256": "70AD4178D04CC5B60ADC9C0CC7B883E57F25D6BB2300645678F978E1869AC422"
  },
  "program_sha256": "39733496C15A95F3B91507F407D04076C2ECE7CD9539A836CF5EF33B25ED286C",
  "comparisons": [
    {
      "name": "normalized_structure_sha256",
      "status": "PASS",
      "expected": "B35F1727D89BF76A00D584137C74F938FA43350987E0819050913E7D71AE4EF9",
      "actual": "B35F1727D89BF76A00D584137C74F938FA43350987E0819050913E7D71AE4EF9"
    },
    {
      "name": "visual_proxy_sha256",
      "status": "PASS",
      "expected": "F27AD06C9B752D3FC6A0162FB7DA9255762B5A64BB9A5FE9B7DD7ACF8D26A899",
      "actual": "F27AD06C9B752D3FC6A0162FB7DA9255762B5A64BB9A5FE9B7DD7ACF8D26A899"
    },
    {
      "name": "structural_parts",
      "status": "PASS",
      "expected": [
        "[Content_Types].xml",
        "_rels/.rels",
        "word/_rels/document.xml.rels",
        "word/_rels/footer1.xml.rels",
        "word/_rels/header1.xml.rels",
        "word/document.xml",
        "word/fontTable.xml",
        "word/footer1.xml",
        "word/header1.xml",
        "word/numbering.xml",
        "word/settings.xml",
        "word/styles.xml",
        "word/stylesWithEffects.xml",
        "word/theme/theme1.xml",
        "word/webSettings.xml"
      ],
      "actual": [
        "[Content_Types].xml",
        "_rels/.rels",
        "word/_rels/document.xml.rels",
        "word/_rels/footer1.xml.rels",
        "word/_rels/header1.xml.rels",
        "word/document.xml",
        "word/fontTable.xml",
        "word/footer1.xml",
        "word/header1.xml",
        "word/numbering.xml",
        "word/settings.xml",
        "word/styles.xml",
        "word/stylesWithEffects.xml",
        "word/theme/theme1.xml",
        "word/webSettings.xml"
      ]
    },
    {
      "name": "page_contract",
      "status": "PASS",
      "expected": {
        "sections": [
          {
            "index": 1,
            "type": "continuous",
            "page_size_twips": {
              "width": 11906,
              "height": 16838,
              "orientation": "portrait"
            },
            "margins_twips": {
              "top": 454,
              "right": 850,
              "bottom": 454,
              "left": 850,
              "header": 360,
              "footer": 360,
              "gutter": 0
            },
            "title_page": false,
            "headers": [
              {
                "type": "default",
                "relationship_id": "rId12"
              }
            ],
            "footers": [
              {
                "type": "default",
                "relationship_id": "rId13"
              }
            ]
          }
        ],
        "different_even_odd_headers": false,
        "regions": [
          {
            "role": "body",
            "section_indexes": [
              1
            ],
            "recognition_source": "deterministic"
          }
        ]
      },
      "actual": {
        "sections": [
          {
            "index": 1,
            "type": "continuous",
            "page_size_twips": {
              "width": 11906,
              "height": 16838,
              "orientation": "portrait"
            },
            "margins_twips": {
              "top": 454,
              "right": 850,
              "bottom": 454,
              "left": 850,
              "header": 360,
              "footer": 360,
              "gutter": 0
            },
            "title_page": false,
            "headers": [
              {
                "type": "default",
                "relationship_id": "rId12"
              }
            ],
            "footers": [
              {
                "type": "default",
                "relationship_id": "rId13"
              }
            ]
          }
        ],
        "different_even_odd_headers": false,
        "regions": [
          {
            "role": "body",
            "section_indexes": [
              1
            ],
            "recognition_source": "deterministic"
          }
        ]
      }
    },
    {
      "name": "styles",
      "status": "PASS",
      "expected": [
        {
          "style_id": "BodyText2Char",
          "type": "character",
          "name": "Body Text 2 Char",
          "based_on": "DefaultParagraphFont"
        },
        {
          "style_id": "BodyText3Char",
          "type": "character",
          "name": "Body Text 3 Char",
          "based_on": "DefaultParagraphFont"
        },
        {
          "style_id": "BodyTextChar",
          "type": "character",
          "name": "Body Text Char",
          "based_on": "DefaultParagraphFont"
        },
        {
          "style_id": "BookTitle",
          "type": "character",
          "name": "Book Title",
          "based_on": "DefaultParagraphFont"
        },
        {
          "style_id": "DefaultParagraphFont",
          "type": "character",
          "name": "Default Paragraph Font",
          "based_on": ""
        },
        {
          "style_id": "Emphasis",
          "type": "character",
          "name": "Emphasis",
          "based_on": "DefaultParagraphFont"
        },
        {
          "style_id": "FooterChar",
          "type": "character",
          "name": "Footer Char",
          "based_on": "DefaultParagraphFont"
        },
        {
          "style_id": "HeaderChar",
          "type": "character",
          "name": "Header Char",
          "based_on": "DefaultParagraphFont"
        },
        {
          "style_id": "Heading1Char",
          "type": "character",
          "name": "Heading 1 Char",
          "based_on": "DefaultParagraphFont"
        },
        {
          "style_id": "Heading2Char",
          "type": "character",
          "name": "Heading 2 Char",
          "based_on": "DefaultParagraphFont"
        },
        {
          "style_id": "Heading3Char",
          "type": "character",
          "name": "Heading 3 Char",
          "based_on": "DefaultParagraphFont"
        },
        {
          "style_id": "Heading4Char",
          "type": "character",
          "name": "Heading 4 Char",
          "based_on": "DefaultParagraphFont"
        },
        {
          "style_id": "Heading5Char",
          "type": "character",
          "name": "Heading 5 Char",
          "based_on": "DefaultParagraphFont"
        },
        {
          "style_id": "Heading6Char",
          "type": "character",
          "name": "Heading 6 Char",
          "based_on": "DefaultParagraphFont"
        },
        {
          "style_id": "Heading7Char",
          "type": "character",
          "name": "Heading 7 Char",
          "based_on": "DefaultParagraphFont"
        },
        {
          "style_id": "Heading8Char",
          "type": "character",
          "name": "Heading 8 Char",
          "based_on": "DefaultParagraphFont"
        },
        {
          "style_id": "Heading9Char",
          "type": "character",
          "name": "Heading 9 Char",
          "based_on": "DefaultParagraphFont"
        },
        {
          "style_id": "IntenseEmphasis",
          "type": "character",
          "name": "Intense Emphasis",
          "based_on": "DefaultParagraphFont"
        },
        {
          "style_id": "IntenseQuoteChar",
          "type": "character",
          "name": "Intense Quote Char",
          "based_on": "DefaultParagraphFont"
        },
        {
          "style_id": "IntenseReference",
          "type": "character",
          "name": "Intense Reference",
          "based_on": "DefaultParagraphFont"
        },
        {
          "style_id": "MacroTextChar",
          "type": "character",
          "name": "Macro Text Char",
          "based_on": "DefaultParagraphFont"
        },
        {
          "style_id": "QuoteChar",
          "type": "character",
          "name": "Quote Char",
          "based_on": "DefaultParagraphFont"
        },
        {
          "style_id": "Strong",
          "type": "character",
          "name": "Strong",
          "based_on": "DefaultParagraphFont"
        },
        {
          "style_id": "SubtitleChar",
          "type": "character",
          "name": "Subtitle Char",
          "based_on": "DefaultParagraphFont"
        },
        {
          "style_id": "SubtleEmphasis",
          "type": "character",
          "name": "Subtle Emphasis",
          "based_on": "DefaultParagraphFont"
        },
        {
          "style_id": "SubtleReference",
          "type": "character",
          "name": "Subtle Reference",
          "based_on": "DefaultParagraphFont"
        },
        {
          "style_id": "TitleChar",
          "type": "character",
          "name": "Title Char",
          "based_on": "DefaultParagraphFont"
        },
        {
          "style_id": "NoList",
          "type": "numbering",
          "name": "No List",
          "based_on": ""
        },
        {
          "style_id": "BodyText",
          "type": "paragraph",
          "name": "Body Text",
          "based_on": "Normal"
        },
        {
          "style_id": "BodyText2",
          "type": "paragraph",
          "name": "Body Text 2",